title,venue,year,citations(acm),available,reusable,functional,replicated,reproduced
Viatra solver: a framework for the automated generation of consistent domain-specific models,ICSE '19,2019,0,0,0,0,0,0
Mockingbird: a framework for enabling targeted dynamic analysis of Java programs,ICSE '19,2019,0,0,0,0,0,0
ALPACA: a large portfolio-based alternating conditional analysis,ICSE '19,2019,0,0,0,0,0,0
AC3R: automatically reconstructing car crashes from police reports,ICSE '19,2019,1,0,0,0,0,0
AsFault: testing self-driving car software using search-based procedural content generation,ICSE '19,2019,1,0,0,0,0,0
EasyFlow: keep ethereum away from overflow,ICSE '19,2019,2,0,0,0,0,0
IoT composer: composition and deployment of IoT applications,ICSE '19,2019,2,0,0,0,0,0
VeDebug: regression debugging tool for Java,ICSE '19,2019,0,0,0,0,0,0
SMT-based refutation of spurious bug reports in the clang static analyzer,ICSE '19,2019,0,0,0,0,0,0
Developing games that capture and engage users,ICSE '19,2019,0,0,0,0,0,0
Software engineering for automated vehicles: addressing the needs of cars that run on software and data,ICSE '19,2019,0,0,0,0,0,0
AIOps: real-world challenges and research innovations,ICSE '19,2019,0,0,0,0,0,0
Analyzing flow to measure value in software delivery,ICSE '19,2019,0,0,0,0,0,0
Publish or perish: questioning the impact of our research on the software developer,ICSE '19,2019,1,0,0,0,0,0
Managing variation: an industrial perspective on product line engineering,ICSE '19,2019,0,0,0,0,0,0
Implementation science for software engineering: bridging the gap between research and practice (keynote),ASE 2018,2018,0,0,0,0,0,0
The need for context in software engineering (IEEE CS Harlan Mills award keynote),ASE 2018,2018,2,0,0,0,0,0
Automated requirements engineering challenges with examples from small unmanned aerial systems (keynote),ASE 2018,2018,0,0,0,0,0,0
Software heritage: collecting preserving and sharing all our source code (keynote),ASE 2018,2018,0,0,0,0,0,0
Automatically quantifying the impact of a change in systems (journal-first abstract),ASE 2018,2018,0,0,0,0,0,0
Understanding Semi-structured merge conflict characteristics in open-source Java projects (journal-first abstract),ASE 2018,2018,1,0,0,0,0,0
Estimating the number of remaining links in traceability recovery (journal-first abstract),ASE 2018,2018,0,0,0,0,0,0
Bounded model checking of C++ programs based on the Qt cross-platform framework (journal-first abstract),ASE 2018,2018,0,0,0,0,0,0
A DSL for requirements in the context of a seamless approach,ASE 2018,2018,0,0,0,0,0,0
Differential program analysis with fuzzing and symbolic execution,ASE 2018,2018,0,0,0,0,0,0
Top-down model-driven engineering of web services from extended OpenAPI models,ASE 2018,2018,0,0,0,0,0,0
A multi-objective framework for effective performance fault injection in distributed systems,ASE 2018,2018,0,0,0,0,0,0
Software engineering techniques applied to relational databases,ASE 2018,2018,0,0,0,0,0,0
Towards automatic restrictification of CUDA kernel arguments,ASE 2018,2018,0,0,0,0,0,0
Automatic mining of constraints for monitoring systems of systems,ASE 2018,2018,1,0,0,0,0,0
Assessing and evaluating functional suitability of software,ASE 2018,2018,0,0,0,0,0,0
An empirical investigation into learning bug-fixing patches in the wild via neural machine translation,ASE 2018,2018,10,0,0,0,0,0
Loop path reduction by state pruning,ASE 2018,2018,0,0,0,0,0,0
Delta debugging microservice systems,ASE 2018,2018,1,0,0,0,0,0
Continuous code quality: are we (really) doing that?,ASE 2018,2018,6,0,0,0,0,0
S-gram: towards semantic-aware security auditing for Ethereum smart contracts,ASE 2018,2018,8,0,0,0,0,0
Towards automating disambiguation of regulations: using the wisdom of crowds,ASE 2018,2018,1,0,0,0,0,0
code_call_lens: raising the developer awareness of critical code,ASE 2018,2018,0,0,0,0,0,0
L-CMP: an automatic learning-based parameterized verification tool,ASE 2018,2018,0,0,0,0,0,0
Lightweight source code monitoring with Triggr,ASE 2018,2018,1,0,0,0,0,0
CANAL: a cache timing analysis framework via LLVM transformation,ASE 2018,2018,7,0,0,0,0,0
Code2graph: automatic generation of static call graphs for Python source code,ASE 2018,2018,5,0,0,0,0,0
Live versioning of web applications through refactoring,ASE 2018,2018,1,0,0,0,0,0
SRCIROR: a toolset for mutation testing of C source code and LLVM intermediate representation,ASE 2018,2018,2,0,0,0,0,0
ESBMC 5.0: an industrial-strength C model checker,ASE 2018,2018,13,0,0,0,0,0
VulSeeker: a semantic learning based vulnerability seeker for cross-platform binary,ASE 2018,2018,5,0,0,0,0,0
DroidMate-2: a platform for Android test generation,ASE 2018,2018,3,1,0,0,0,0
CPA-SymExec: efficient symbolic execution in CPAchecker,ASE 2018,2018,1,1,0,0,0,0
OCELOT: a search-based test-data generation tool for C,ASE 2018,2018,0,0,0,0,0,0
DKVF: a framework for rapid prototyping and evaluating distributed key-value stores,ASE 2018,2018,2,0,0,0,0,0
The electrum analyzer: model checking relational first-order temporal specifications,ASE 2018,2018,2,0,0,0,0,0
Descartes: a PITest engine to detect pseudo-tested methods: tool demonstration,ASE 2018,2018,2,0,0,0,0,0
jStanley: placing a green thumb on Java collections,ASE 2018,2018,4,0,0,0,0,0
Personalized teammate recommendation for crowdsourced software developers,ASE 2018,2018,1,0,0,0,0,0
A neural framework for retrieval and summarization of source code,ASE 2018,2018,7,0,0,0,0,0
RUDSEA: recommending updates of Dockerfiles via software environment analysis,ASE 2018,2018,8,0,0,0,0,0
node2defect: using network embedding to improve software defect prediction,ASE 2018,2018,0,0,0,0,0,0
An evolutionary approach for analyzing Alloy specifications,ASE 2018,2018,3,0,0,0,0,0
Experiences applying automated architecture analysis tool suites,ASE 2018,2018,4,0,0,0,0,0
Navigating the maze: the impact of configurability in bioinformatics software,ASE 2018,2018,3,0,0,0,0,0
An empirical study of Android test generation tools in industrial cases,ASE 2018,2018,11,0,0,0,0,0
Automatically testing implementations of numerical abstract domains,ASE 2018,2018,4,0,0,0,0,0
Achieving test automation with testers without coding skills: an industrial report,ASE 2018,2018,0,0,0,0,0,0
Template-guided concolic testing via online learning,ASE 2018,2018,2,0,0,0,0,0
A unified lattice model and framework for purity analyses,ASE 2018,2018,1,0,0,0,0,0
Android testing via synthetic symbolic execution,ASE 2018,2018,4,0,0,0,0,0
Effectiveness and challenges in generating concurrent tests for thread-safe classes,ASE 2018,2018,4,0,0,0,0,0
Scheduling constraint based abstraction refinement for weak memory models,ASE 2018,2018,1,0,0,0,0,0
Expandable group identification in spreadsheets,ASE 2018,2018,7,0,0,0,0,0
Dual-force: understanding WebView malware via cross-language forced execution,ASE 2018,2018,1,0,0,0,0,0
A genetic algorithm for goal-conflict identification,ASE 2018,2018,0,0,0,0,0,0
ClDiff: generating concise linked code differences,ASE 2018,2018,7,0,0,0,0,0
Control flow-guided SMT solving for program verification,ASE 2018,2018,3,0,0,0,0,0
Reducing interactive refactoring effort via clustering-based multi-objective search,ASE 2018,2018,4,0,0,0,0,0
Effective API recommendation without historical software repositories,ASE 2018,2018,3,0,0,0,0,0
Empirically assessing opportunities for prefetching and caching in mobile apps,ASE 2018,2018,2,0,0,0,0,0
An automated approach to estimating code coverage measures via execution logs,ASE 2018,2018,7,0,0,0,0,0
How many of all bugs do we find? a study of static bug detectors,ASE 2018,2018,2,0,0,0,0,0
Is this class thread-safe? inferring documentation using graph-based learning,ASE 2018,2018,2,0,0,0,0,0
Datalog-based scalable semantic diffing of concurrent programs,ASE 2018,2018,3,0,0,0,0,0
PaMpeR: proof method recommendation system for Isabelle/HOL,ASE 2018,2018,4,0,0,0,0,0
Tell them apart: distilling technology differences from crowd-scale comparison discussions,ASE 2018,2018,3,0,0,0,0,0
Self-protection of Android systems from inter-component communication attacks,ASE 2018,2018,3,0,0,0,0,0
Improving automatic source code summarization via deep reinforcement learning,ASE 2018,2018,10,0,0,0,0,0
PerfLearner: learning from bug reports to understand and generate performance test frames,ASE 2018,2018,7,0,0,0,0,0
Detecting and summarizing GUI changes in evolving mobile apps,ASE 2018,2018,4,0,0,0,0,0
DeepGauge: multi-granularity testing criteria for deep learning systems,ASE 2018,2018,42,0,0,0,0,0
Tackling combinatorial explosion: a study of industrial needs and practices for analyzing highly configurable systems,ASE 2018,2018,10,0,0,0,0,0
Semantic crash bucketing,ASE 2018,2018,7,0,0,0,0,0
αDiff: cross-version binary code similarity detection with DNN,ASE 2018,2018,3,0,0,0,0,0
PFix: fixing concurrency bugs based on memory access patterns,ASE 2018,2018,5,0,0,0,0,0
On adopting linters to deal with performance concerns in Android apps,ASE 2018,2018,6,1,0,0,0,0
Scalable incremental building with dynamic task dependencies,ASE 2018,2018,0,0,0,0,0,0
Domain-independent multi-threaded software model checking,ASE 2018,2018,1,1,0,0,0,0
Generating reusable web components from mockups,ASE 2018,2018,2,0,0,0,0,0
Characterizing the natural language descriptions in software logging statements,ASE 2018,2018,9,0,0,0,0,0
Testing autonomous cars for feature interaction failures using many-objective search,ASE 2018,2018,12,0,0,0,0,0
API method recommendation without worrying about the task-API knowledge gap,ASE 2018,2018,12,0,0,0,0,0
Neural-machine-translation-based commit message generation: how far are we?,ASE 2018,2018,11,0,0,0,0,0
A symbolic model checking approach to the analysis of string and length constraints,ASE 2018,2018,1,0,0,0,0,0
TDroid: exposing app switching attacks in Android with control flow specialization,ASE 2018,2018,3,0,0,0,0,0
DeepRoad: GAN-based metamorphic testing and input validation framework for autonomous driving systems,ASE 2018,2018,31,0,0,0,0,0
Replay without recording of production bugs for service oriented applications,ASE 2018,2018,1,0,0,0,0,0
Understanding and detecting evolution-induced compatibility issues in Android apps,ASE 2018,2018,7,0,0,0,0,0
A large-scale study of test coverage evolution,ASE 2018,2018,10,0,0,0,0,0
SEEDE: simultaneous execution and editing in a development environment,ASE 2018,2018,1,0,0,0,0,0
Understanding and detecting callback compatibility issues for Android applications,ASE 2018,2018,2,0,0,0,0,0
A tale of two cities: how WebView induces bugs to Android applications,ASE 2018,2018,5,0,0,0,0,0
PARTI: a multi-interval theory solver for symbolic execution,ASE 2018,2018,2,0,0,0,0,0
Client-specific equivalence checking,ASE 2018,2018,2,0,0,0,0,0
ContractFuzzer: fuzzing smart contracts for vulnerability detection,ASE 2018,2018,38,1,0,0,0,0
FairFuzz: a targeted mutation strategy for increasing greybox fuzz testing coverage,ASE 2018,2018,29,0,0,0,0,0
AutoConfig: automatic configuration tuning for distributed message systems,ASE 2018,2018,4,0,0,0,0,0
Safe stream-based programming with refinement types,ASE 2018,2018,2,0,0,0,0,0
Assessing the type annotation burden,ASE 2018,2018,1,0,0,0,0,0
Concolic testing for deep neural networks,ASE 2018,2018,30,0,0,0,0,0
Noise and heterogeneity in historical build data: an empirical study of Travis CI,ASE 2018,2018,6,0,0,0,0,0
Efficiently manifesting asynchronous programming errors in Android apps,ASE 2018,2018,9,0,0,0,0,0
Mining file histories: should we consider branches?,ASE 2018,2018,6,0,0,0,0,0
Model-driven run-time enforcement of complex role-based access control policies,ASE 2018,2018,1,0,0,0,0,0
Deep learning based feature envy detection,ASE 2018,2018,8,0,0,0,0,0
Automated directed fairness testing,ASE 2018,2018,5,0,0,0,0,0
Characterizing and identifying misexposed activities in Android applications,ASE 2018,2018,2,0,0,0,0,0
Break the dead end of dynamic slicing: localizing data and control omission bug,ASE 2018,2018,4,0,0,0,0,0
Automated model repair for Alloy,ASE 2018,2018,5,0,0,0,0,0
TRIMMER: application specialization for code debloating,ASE 2018,2018,13,0,0,0,0,0
ReScue: crafting regular expression DoS attacks,ASE 2018,2018,5,0,0,0,0,0
