title,venue,year,citations(acm),available,reusable,functional,replicated,reproduced
Insights from open source software supply chains (keynote),ESEC/FSE 2019,2019,0,0,0,0,0,0
Safety and robustness for deep learning with provable guarantees (keynote),ESEC/FSE 2019,2019,0,0,0,0,0,0
Living with feature interactions (keynote),ESEC/FSE 2019,2019,0,0,0,0,0,0
Empirical study of customer communication problem in agile requirements engineering,ESEC/FSE 2019,2019,0,0,0,0,0,0
Context-aware test case adaptation,ESEC/FSE 2019,2019,0,0,0,0,0,0
Rethinking Regex engines to address ReDoS,ESEC/FSE 2019,2019,0,0,0,0,0,0
Using software testing to repair models,ESEC/FSE 2019,2019,0,0,0,0,0,0
Suggesting reviewers of software artifacts using traceability graphs,ESEC/FSE 2019,2019,1,0,0,0,0,0
On the scalable dynamic taint analysis for distributed systems,ESEC/FSE 2019,2019,0,0,0,0,0,0
Tackling knowledge needs during software evolution,ESEC/FSE 2019,2019,1,0,0,0,0,0
Are existing code smells relevant in web games? an empirical study,ESEC/FSE 2019,2019,0,0,0,0,0,0
Static deep neural network analysis for robustness,ESEC/FSE 2019,2019,0,0,0,0,0,0
Test-related factors and post-release defects: an empirical study,ESEC/FSE 2019,2019,0,0,0,0,0,0
On the use of lambda expressions in 760 open source Python projects,ESEC/FSE 2019,2019,2,0,0,0,0,0
Tuning backfired? not (always) your fault: understanding and detecting configuration-related performance bugs,ESEC/FSE 2019,2019,1,0,0,0,0,0
Analysing socio-technical congruence in the package dependency network of Cargo,ESEC/FSE 2019,2019,0,0,0,0,0,0
Finding the shortest path to reproduce a failure found by TESTAR,ESEC/FSE 2019,2019,1,0,0,0,0,0
A graph-based framework for analysing the design of smart contracts,ESEC/FSE 2019,2019,1,0,0,0,0,0
Understanding source code comments at large-scale,ESEC/FSE 2019,2019,0,0,0,0,0,0
An industrial application of test selection using test suite diagnosability,ESEC/FSE 2019,2019,0,0,0,0,0,0
The lessons software engineers can extract from painters to improve the software development process,ESEC/FSE 2019,2019,0,0,0,0,0,0
Efficient computing in a safe environment,ESEC/FSE 2019,2019,0,0,0,0,0,0
Reducing the workload of the Linux kernel maintainers: multiple-committer model,ESEC/FSE 2019,2019,1,0,0,0,0,0
Employing different program analysis methods to study bug evolution,ESEC/FSE 2019,2019,0,0,0,0,0,0
Automated patch porting across forked projects,ESEC/FSE 2019,2019,0,0,0,0,0,0
Identifying the most valuable developers using artifact traceability graphs,ESEC/FSE 2019,2019,0,0,0,0,0,0
Recommending related functions from API usage-based function clone structures,ESEC/FSE 2019,2019,0,0,0,0,0,0
File tracing by intercepting disk requests,ESEC/FSE 2019,2019,0,0,0,0,0,0
Machine learning-assisted performance testing,ESEC/FSE 2019,2019,0,0,0,0,0,0
Software clusterings with vector semantics and the call graph,ESEC/FSE 2019,2019,0,0,0,0,0,0
On extending single-variant model transformations for reuse in software product line engineering,ESEC/FSE 2019,2019,0,0,0,0,0,0
Machine-learning supported vulnerability detection in source code,ESEC/FSE 2019,2019,0,0,0,0,0,0
Improving requirements engineering practices to support experimentation in software startups,ESEC/FSE 2019,2019,0,0,0,0,0,0
Failure-driven program repair,ESEC/FSE 2019,2019,0,0,0,0,0,0
A longitudinal field study on creation and use of domain-specific languages in industry,ESEC/FSE 2019,2019,0,0,0,0,0,0
A taxonomy of metrics for software fault prediction,ESEC/FSE 2019,2019,0,0,0,0,0,0
Managing the open cathedral,ESEC/FSE 2019,2019,0,0,0,0,0,0
Distributed execution of test cases and continuous integration,ESEC/FSE 2019,2019,0,0,0,0,0,0
Helping developers search and locate task-relevant information in natural language documents,ESEC/FSE 2019,2019,0,0,0,0,0,0
Exploratory test agents for stateful software systems,ESEC/FSE 2019,2019,0,0,0,0,0,0
MOTSD: a multi-objective test selection tool using test suite diagnosability,ESEC/FSE 2019,2019,2,0,0,0,0,0
AnswerBot: an answer summary generation tool based on stack overflow,ESEC/FSE 2019,2019,1,0,0,0,0,0
VARYS: an agnostic model-driven monitoring-as-a-service framework for the cloud,ESEC/FSE 2019,2019,1,0,0,0,0,0
PyGGI 2.0: language independent genetic improvement framework,ESEC/FSE 2019,2019,3,0,0,0,0,0
Event trace reduction for effective bug replay of Android apps via differential GUI state analysis,ESEC/FSE 2019,2019,1,0,0,0,0,0
CloneCognition: machine learning based code clone validation tool,ESEC/FSE 2019,2019,1,0,0,0,0,0
Eagle: a team practices audit framework for agile software development,ESEC/FSE 2019,2019,2,0,0,0,0,0
Mart: a mutant generation tool for LLVM,ESEC/FSE 2019,2019,0,0,0,0,0,0
A dynamic taint analyzer for distributed systems,ESEC/FSE 2019,2019,0,0,0,0,0,0
JCOMIX: a search-based tool to detect XML injection vulnerabilities in web applications,ESEC/FSE 2019,2019,0,0,0,0,0,0
DISCOVER: detecting algorithmic complexity vulnerabilities,ESEC/FSE 2019,2019,0,0,0,0,0,0
Governify for APIs: SLA-driven ecosystem for API governance,ESEC/FSE 2019,2019,2,0,0,0,0,0
EVMFuzzer: detect EVM vulnerabilities via fuzz testing,ESEC/FSE 2019,2019,3,0,0,0,0,0
BIKER: a tool for Bi-information source based API method recommendation,ESEC/FSE 2019,2019,0,0,0,0,0,0
Developing secure bitcoin contracts with BitML,ESEC/FSE 2019,2019,2,0,0,0,0,0
Architectural decision forces at work: experiences in an industrial consultancy setting,ESEC/FSE 2019,2019,1,0,0,0,0,0
Industry practice of coverage-guided enterprise Linux kernel fuzzing,ESEC/FSE 2019,2019,3,0,0,0,0,0
Code coverage at Google,ESEC/FSE 2019,2019,2,0,0,0,0,0
When deep learning met code search,ESEC/FSE 2019,2019,1,0,0,0,0,0
Predicting pull request completion time: a case study on large scale cloud services,ESEC/FSE 2019,2019,0,0,0,0,0,0
FUDGE: fuzz driver generation at scale,ESEC/FSE 2019,2019,1,0,0,0,0,0
DeepDelta: learning to repair compilation errors,ESEC/FSE 2019,2019,1,0,0,0,0,0
An IR-based approach towards automated integration of geo-spatial datasets in map-based software systems,ESEC/FSE 2019,2019,0,0,0,0,0,0
Model checking a C++ software framework: a case study,ESEC/FSE 2019,2019,1,0,0,0,0,0
Using microservices for non-intrusive customization of multi-tenant SaaS,ESEC/FSE 2019,2019,1,0,0,0,0,0
Design thinking in practice: understanding manifestations of design thinking in software engineering,ESEC/FSE 2019,2019,1,0,0,0,0,0
Predicting breakdowns in cloud services (with SPIKE),ESEC/FSE 2019,2019,0,0,0,0,0,0
WhoDo: automating reviewer suggestions at scale,ESEC/FSE 2019,2019,0,0,0,0,0,0
TERMINATOR: better automated UI test case prioritization,ESEC/FSE 2019,2019,1,0,0,0,0,0
Evolving with patterns: a 31-month startup experience report,ESEC/FSE 2019,2019,0,0,0,0,0,0
Design diagrams as ontological source,ESEC/FSE 2019,2019,0,0,0,0,0,0
The role of limitations and SLAs in the API industry,ESEC/FSE 2019,2019,2,0,0,0,0,0
Evaluating model testing and model checking for finding requirements violations in Simulink models,ESEC/FSE 2019,2019,2,0,0,0,0,0
Risks and assets: a qualitative study of a software ecosystem in the mining industry,ESEC/FSE 2019,2019,2,0,0,0,0,0
Bridging the gap between ML solutions and their business requirements using feature interactions,ESEC/FSE 2019,2019,1,0,0,0,0,0
FinExpert: domain-specific test generation for FinTech systems,ESEC/FSE 2019,2019,0,0,0,0,0,0
Preference-wise testing for Android applications,ESEC/FSE 2019,2019,2,0,0,0,0,0
Decomposing the rationale of code commits: the software developer’s perspective,ESEC/FSE 2019,2019,0,1,0,0,0,0
Releasing fast and slow: an exploratory case study at ING,ESEC/FSE 2019,2019,0,0,0,0,0,0
SEntiMoji: an emoji-powered learning approach for sentiment analysis in software engineering,ESEC/FSE 2019,2019,0,0,0,0,0,0
Ethnographic research in software engineering: a critical review and checklist,ESEC/FSE 2019,2019,0,0,0,0,0,0
Cerebro: context-aware adaptive fuzzing for effective vulnerability detection,ESEC/FSE 2019,2019,1,0,0,0,0,0
Principles of feature modeling,ESEC/FSE 2019,2019,3,0,0,0,0,0
Symbolic execution-driven extraction of the parallel execution plans of Spark applications,ESEC/FSE 2019,2019,1,0,0,0,0,0
Storm: program reduction for testing and debugging probabilistic programming systems,ESEC/FSE 2019,2019,1,0,0,0,0,0
Generating query-specific class API summaries,ESEC/FSE 2019,2019,0,0,0,0,0,0
Diversity-based web test generation,ESEC/FSE 2019,2019,3,0,0,0,0,0
Achilles’ heel of plug-and-Play software architectures: a grounded theory based approach,ESEC/FSE 2019,2019,1,0,0,0,0,0
Effects of explicit feature traceability on program comprehension,ESEC/FSE 2019,2019,6,1,0,0,0,0
An empirical study of real-world variability bugs detected by variability-oblivious tools,ESEC/FSE 2019,2019,0,1,1,0,0,0
Locating vulnerabilities in binaries via memory layout recovering,ESEC/FSE 2019,2019,2,0,0,0,0,0
A framework for writing trigger-action todo comments in executable format,ESEC/FSE 2019,2019,0,0,0,0,0,0
Concolic testing with adaptively changing search heuristics,ESEC/FSE 2019,2019,1,0,0,0,0,0
A learning-based approach for automatic construction of domain glossary from source code and documentation,ESEC/FSE 2019,2019,0,0,0,0,0,0
Exploring and exploiting the correlations between bug-inducing and bug-fixing commits,ESEC/FSE 2019,2019,0,0,0,0,0,0
Latent error prediction and fault localization for microservice applications by learning from system trace logs,ESEC/FSE 2019,2019,1,0,0,0,0,0
Effective error-specification inference via domain-knowledge expansion,ESEC/FSE 2019,2019,1,1,1,0,0,0
AggrePlay: efficient record and replay of multi-threaded programs,ESEC/FSE 2019,2019,1,0,0,0,0,0
REINAM: reinforcement learning for input-grammar inference,ESEC/FSE 2019,2019,2,0,0,0,0,0
Compiler bug isolation via effective witness test program generation,ESEC/FSE 2019,2019,7,0,0,0,0,0
Binary reduction of dependency graphs,ESEC/FSE 2019,2019,1,1,1,0,0,0
A comprehensive study on deep learning bug characteristics,ESEC/FSE 2019,2019,0,0,0,0,0,0
DeepStellar: model-based quantitative analysis of stateful deep learning systems,ESEC/FSE 2019,2019,11,0,0,0,0,0
White-box testing of big data analytics with complex user-defined functions,ESEC/FSE 2019,2019,1,0,0,0,0,0
Phoenix: automated data-driven synthesis of repairs for static analysis violations,ESEC/FSE 2019,2019,1,0,0,0,0,0
Maximal multi-layer specification synthesis,ESEC/FSE 2019,2019,2,0,0,0,0,0
ServDroid: detecting service usage inefficiencies in Android applications,ESEC/FSE 2019,2019,0,0,0,0,0,0
The review linkage graph for code review analytics: a recovery approach and empirical study,ESEC/FSE 2019,2019,1,1,0,0,0,0
Web test dependency detection,ESEC/FSE 2019,2019,3,0,0,0,0,0
Assessing the quality of the steps to reproduce in bug reports,ESEC/FSE 2019,2019,1,0,0,0,0,0
Java reflection API: revealing the dark side of the mirror,ESEC/FSE 2019,2019,1,0,0,0,0,0
Understanding flaky tests: the developer’s perspective,ESEC/FSE 2019,2019,1,0,0,0,0,0
Bisecting commits and modeling commit risk during testing,ESEC/FSE 2019,2019,1,0,0,0,0,0
On using machine learning to identify knowledge in API reference documentation,ESEC/FSE 2019,2019,1,1,0,0,0,0
Generating effective test cases for self-driving cars from police reports,ESEC/FSE 2019,2019,3,0,0,0,0,0
The importance of accounting for real-world labelling when predicting software vulnerabilities,ESEC/FSE 2019,2019,1,0,0,0,0,0
Model-based testing of breaking changes in Node.js libraries,ESEC/FSE 2019,2019,0,0,1,0,0,0
Going big: a large-scale study on what big data developers ask,ESEC/FSE 2019,2019,2,0,0,0,0,0
Automatically detecting missing cleanup for ungraceful exits,ESEC/FSE 2019,2019,1,0,0,0,0,0
Black box fairness testing of machine learning models,ESEC/FSE 2019,2019,1,0,0,0,0,0
A segmented memory model for symbolic execution,ESEC/FSE 2019,2019,2,1,1,0,0,0
iFixR: bug report driven program repair,ESEC/FSE 2019,2019,4,1,1,0,0,0
Target-driven compositional concolic testing with function summary refinement for effective bug detection,ESEC/FSE 2019,2019,2,0,0,0,0,0
Nodest: feedback-driven static analysis of Node.js applications,ESEC/FSE 2019,2019,0,0,0,0,0,0
Finding and understanding bugs in software model checkers,ESEC/FSE 2019,2019,0,0,0,0,0,0
Robust log-based anomaly detection on unstable log data,ESEC/FSE 2019,2019,3,0,0,0,0,0
Boosting operational DNN testing efficiency through conditioning,ESEC/FSE 2019,2019,1,0,0,0,0,0
Semantic relation based expansion of abbreviations,ESEC/FSE 2019,2019,0,0,0,0,0,0
Lifting Datalog-based analyses to software product lines,ESEC/FSE 2019,2019,1,0,0,0,0,0
Detecting concurrency memory corruption vulnerabilities,ESEC/FSE 2019,2019,1,0,0,0,0,0
Monitoring-aware IDEs,ESEC/FSE 2019,2019,0,0,0,0,0,0
iFixFlakies: a framework for automatically fixing order-dependent flaky tests,ESEC/FSE 2019,2019,0,0,0,0,0,0
SAR: learning cross-language API mappings with little knowledge,ESEC/FSE 2019,2019,0,1,1,0,0,0
Pinpointing performance inefficiencies in Java,ESEC/FSE 2019,2019,1,0,0,0,0,0
A conceptual replication of continuous integration pain points in the context of Travis CI,ESEC/FSE 2019,2019,0,0,0,0,0,0
Just fuzz it: solving floating-point constraints using coverage-guided fuzzing,ESEC/FSE 2019,2019,2,1,0,0,0,0
Generating automated and online test oracles for Simulink models with continuous and uncertain behaviors,ESEC/FSE 2019,2019,4,1,1,0,0,0
NullAway: practical type-based null safety for Java,ESEC/FSE 2019,2019,0,1,1,0,0,0
What the fork: a study of inefficient and efficient forking practices in social coding,ESEC/FSE 2019,2019,1,0,0,0,0,0
A large-scale empirical study of compiler errors in continuous integration,ESEC/FSE 2019,2019,0,0,0,0,0,0
How bad can a bug get? an empirical analysis of software failures in the OpenStack cloud computing platform,ESEC/FSE 2019,2019,1,1,1,0,0,0
Together strong: cooperative Android app analysis,ESEC/FSE 2019,2019,0,1,0,0,0,0
Towards more efficient meta-heuristic algorithms for combinatorial test generation,ESEC/FSE 2019,2019,0,0,0,0,0,0
Mitigating power side channels during compilation,ESEC/FSE 2019,2019,2,0,0,0,0,0
A statistics-based performance testing methodology for cloud applications,ESEC/FSE 2019,2019,3,1,1,0,0,0
Empirical review of Java program repair tools: a large-scale experiment on 2141 bugs and 23551 repair attempts,ESEC/FSE 2019,2019,1,1,1,0,0,0
Testing scratch programs automatically,ESEC/FSE 2019,2019,1,0,0,0,0,0
Why aren’t regular expressions a lingua franca? an empirical study on the re-use and portability of regular expressions,ESEC/FSE 2019,2019,2,1,1,0,0,0
Concolic testing for models of state-based systems,ESEC/FSE 2019,2019,1,0,1,0,0,0
Understanding GCC builtins to develop better tools,ESEC/FSE 2019,2019,0,1,1,0,0,0
Ten years of hunting for similar code for fun and profit (keynote),ESEC/FSE 2018,2018,0,0,0,0,0,0
Behind every great deep learning framework is an even greater programming languages concept (keynote),ESEC/FSE 2018,2018,2,0,0,0,0,0
Efficient static checking of library updates,ESEC/FSE 2018,2018,2,0,0,0,0,0
Modeling and testing a family of surgical robots: an experience report,ESEC/FSE 2018,2018,3,0,0,0,0,0
FACTS: automated black-box testing of FinTech systems,ESEC/FSE 2018,2018,1,0,0,0,0,0
Automated refactoring of nested-IF formulae in spreadsheets,ESEC/FSE 2018,2018,3,0,0,0,0,0
Testing and validating end user programmed calculated fields,ESEC/FSE 2018,2018,1,0,0,0,0,0
Design and validation of precooked developer dashboards,ESEC/FSE 2018,2018,4,0,0,0,0,0
The impact of failing flaky and high failure tests on the number of crash reports associated with Firefox builds,ESEC/FSE 2018,2018,2,0,0,0,0,0
Building lean continuous integration and delivery pipelines by applying DevOps principles: a case study at Varidesk,ESEC/FSE 2018,2018,3,0,0,0,0,0
Regression test selection for TizenRT,ESEC/FSE 2018,2018,2,0,0,0,0,0
Software development challenges with air-gap isolation,ESEC/FSE 2018,2018,1,0,0,0,0,0
PAFL: extend fuzzing optimizations of single mode to industrial parallel mode,ESEC/FSE 2018,2018,8,0,0,0,0,0
VulSeeker-pro: enhanced semantic learning based binary vulnerability seeker with emulation,ESEC/FSE 2018,2018,3,0,0,0,0,0
Are mobile banking apps secure? what can be improved?,ESEC/FSE 2018,2018,6,0,0,0,0,0
Diversity and decorum in open source communities,ESEC/FSE 2018,2018,1,0,0,0,0,0
Mining error-handling specifications for systems software,ESEC/FSE 2018,2018,0,0,0,0,0,0
Bugs in the wild: examining the effectiveness of static analyzers at finding real-world bugs,ESEC/FSE 2018,2018,2,0,0,0,0,0
Dara: hybrid model checking of distributed systems,ESEC/FSE 2018,2018,0,0,0,0,0,0
Feature-interaction aware configuration prioritization,ESEC/FSE 2018,2018,0,0,0,0,0,0
How Dance(Sport) can help to produce better software,ESEC/FSE 2018,2018,0,0,0,0,0,0
Reshaping distributed agile and adaptive development environment,ESEC/FSE 2018,2018,0,0,0,0,0,0
Type migration in large-scale code bases,ESEC/FSE 2018,2018,0,0,0,0,0,0
On the adoption of neural networks in modeling software reliability,ESEC/FSE 2018,2018,1,0,0,0,0,0
Towards learning-augmented languages,ESEC/FSE 2018,2018,0,0,0,0,0,0
Automated scenario-based integration testing of distributed systems,ESEC/FSE 2018,2018,0,0,0,0,0,0
How do developers resolve merge conflicts? an investigation into the processes tools and improvements,ESEC/FSE 2018,2018,1,0,0,0,0,0
Quality assurance automation in autonomous systems,ESEC/FSE 2018,2018,0,0,0,0,0,0
Intelligent bug fixing with software bug knowledge graph,ESEC/FSE 2018,2018,0,0,0,0,0,0
Semantic inference from natural language privacy policies and Android code,ESEC/FSE 2018,2018,0,0,0,0,0,0
Moving towards objective measures of program comprehension,ESEC/FSE 2018,2018,0,0,0,0,0,0
Automated support for mobile application testing and maintenance,ESEC/FSE 2018,2018,0,0,0,0,0,0
Practices and tools for better software testing,ESEC/FSE 2018,2018,0,0,0,0,0,0
Operationalizing human values in software: a research roadmap,ESEC/FSE 2018,2018,7,0,0,0,0,0
Towards quantifying the development value of code contributions,ESEC/FSE 2018,2018,0,0,0,0,0,0
Salient-class location: help developers understand code change in code review,ESEC/FSE 2018,2018,2,0,0,0,0,0
Towards counterexample-guided k-induction for fast bug detection,ESEC/FSE 2018,2018,1,0,0,0,0,0
Software engineering collaboratories (SEClabs) and collaboratories as a service (CaaS),ESEC/FSE 2018,2018,0,0,0,0,0,0
Software fairness,ESEC/FSE 2018,2018,3,0,0,0,0,0
Beyond testing configurable systems: applying variational execution to automatic program repair and higher order mutation testing,ESEC/FSE 2018,2018,2,0,0,0,0,0
Towards data-driven vulnerability prediction for requirements,ESEC/FSE 2018,2018,1,0,0,0,0,0
DLFuzz: differential fuzzing testing of deep learning systems,ESEC/FSE 2018,2018,16,0,0,0,0,0
How are spreadsheet templates used in practice: a case study on Enron,ESEC/FSE 2018,2018,0,0,0,0,0,0
Does ACM’s code of ethics change ethical decision making in software development?,ESEC/FSE 2018,2018,13,0,0,0,0,0
On the naturalness of proofs,ESEC/FSE 2018,2018,2,0,0,0,0,0
The case for experiment-oriented computing,ESEC/FSE 2018,2018,0,0,0,0,0,0
Gamifying static analysis,ESEC/FSE 2018,2018,0,0,0,0,0,0
SketchFix: a tool for automated program repair approach using lazy candidate generation,ESEC/FSE 2018,2018,4,0,0,0,0,0
WarningsGuru: integrating statistical bug models with static analysis to provide timely and specific bug warnings,ESEC/FSE 2018,2018,0,0,0,0,0,0
PyDriller: Python framework for mining software repositories,ESEC/FSE 2018,2018,9,0,0,0,0,0
DSM: a specification mining tool using recurrent neural network based language model,ESEC/FSE 2018,2018,1,0,0,0,0,0
EClone: detect semantic clones in Ethereum via symbolic transaction sketch,ESEC/FSE 2018,2018,5,0,0,0,0,0
INFAR: insight extraction from app reviews,ESEC/FSE 2018,2018,2,0,0,0,0,0
ASketch: a sketching framework for Alloy,ESEC/FSE 2018,2018,5,0,0,0,0,0
FOT: a versatile configurable extensible fuzzing framework,ESEC/FSE 2018,2018,5,0,0,0,0,0
Vista: web test repair using computer vision,ESEC/FSE 2018,2018,3,0,0,0,0,0
A formal verification tool for Ethereum VM bytecode,ESEC/FSE 2018,2018,14,0,0,0,0,0
Themis: automatically testing software for discrimination,ESEC/FSE 2018,2018,4,0,0,0,0,0
PowerStation: automatically detecting and fixing inefficiencies of database-backed web applications in IDE,ESEC/FSE 2018,2018,5,0,0,0,0,0
AlloyInEcore: embedding of first-order relational logic into meta-object facility for automated model reasoning,ESEC/FSE 2018,2018,1,0,0,0,0,0
VT-revolution: interactive programming tutorials made possible,ESEC/FSE 2018,2018,1,0,0,0,0,0
BigSift: automated debugging of big data analytics in data-intensive scalable computing,ESEC/FSE 2018,2018,4,0,0,0,0,0
Augmenting stack overflow with API usage patterns mined from GitHub,ESEC/FSE 2018,2018,2,0,0,0,0,0
Code vectors: understanding programs through embedded abstracted symbolic traces,ESEC/FSE 2018,2018,7,0,0,1,0,0
Bug synthesis: challenging bug-finding tools with deep faults,ESEC/FSE 2018,2018,3,0,0,0,0,0
Identifying impactful service system problems via log analysis,ESEC/FSE 2018,2018,9,0,0,0,0,0
MODE: automated neural network model debugging via state differential analysis and input selection,ESEC/FSE 2018,2018,5,0,0,0,0,0
Performance comprehension at WiredTiger,ESEC/FSE 2018,2018,2,0,0,0,0,0
What makes a code change easier to review: an empirical investigation on code change reviewability,ESEC/FSE 2018,2018,8,0,0,0,0,0
MemFix: static analysis-based repair of memory deallocation errors for C,ESEC/FSE 2018,2018,2,0,0,0,0,0
Verifying the long-run behavior of probabilistic system models in the presence of uncertainty,ESEC/FSE 2018,2018,0,0,0,0,0,0
Testing multithreaded programs via thread speed control,ESEC/FSE 2018,2018,4,0,0,0,0,0
Stochastic energy optimization for mobile GPS applications,ESEC/FSE 2018,2018,2,0,0,0,0,0
Large-scale study of substitutability in the presence of effects,ESEC/FSE 2018,2018,0,1,1,1,0,0
Learning to sample: exploiting similarities across environments to learn performance models for configurable systems,ESEC/FSE 2018,2018,7,0,0,0,0,0
Detection of energy inefficiencies in Android wear watch faces,ESEC/FSE 2018,2018,3,1,0,1,0,0
How well are regular expressions tested in the wild?,ESEC/FSE 2018,2018,6,0,0,0,0,0
CloudRaid: hunting concurrency bugs in the cloud via log-mining,ESEC/FSE 2018,2018,2,0,0,0,0,0
Putback-based bidirectional model transformations,ESEC/FSE 2018,2018,1,0,0,0,0,0
Using finite-state models for log differencing,ESEC/FSE 2018,2018,2,0,0,0,0,0
DeepSim: deep learning code functional similarity,ESEC/FSE 2018,2018,9,0,0,0,0,0
Modify enhance select: co-evolution of combinatorial models and test plans,ESEC/FSE 2018,2018,1,0,0,0,0,0
Neural-augmented static analysis of Android communication,ESEC/FSE 2018,2018,2,0,0,0,0,0
Improving IR-based bug localization with context-aware query reformulation,ESEC/FSE 2018,2018,6,1,1,1,0,0
Parameterized model counting for string and numeric constraints,ESEC/FSE 2018,2018,6,1,0,1,0,0
Visual web test repair,ESEC/FSE 2018,2018,10,0,0,0,0,0
Ecosystem-level determinants of sustained activity in open-source projects: a case study of the PyPI ecosystem,ESEC/FSE 2018,2018,10,0,1,1,0,0
Towards a theory of software development expertise,ESEC/FSE 2018,2018,10,1,1,1,0,0
Predicting Node failure in cloud service systems,ESEC/FSE 2018,2018,5,0,0,0,0,0
Path-based function embedding and its application to error-handling specification mining,ESEC/FSE 2018,2018,12,1,1,1,0,0
Which generated test failures are fault revealing? prioritizing failures based on inferred precondition violations using PAF,ESEC/FSE 2018,2018,0,0,0,0,0,0
Testing probabilistic programming systems,ESEC/FSE 2018,2018,6,0,0,0,0,0
Do the dependency conflicts in my project matter?,ESEC/FSE 2018,2018,5,1,1,1,0,0
AppFlow: using machine learning to synthesize robust reusable UI tests,ESEC/FSE 2018,2018,4,0,0,0,0,0
Be careful of when: an empirical study on time-related misuse of issue tracking data,ESEC/FSE 2018,2018,3,0,0,0,0,0
Optimizing test prioritization via test distribution analysis,ESEC/FSE 2018,2018,2,0,0,0,0,0
A novel automated approach for software effort estimation based on data augmentation,ESEC/FSE 2018,2018,4,0,0,0,0,0
Deep learning type inference,ESEC/FSE 2018,2018,13,0,0,0,0,0
Applications of psychological science for actionable analytics,ESEC/FSE 2018,2018,3,0,0,0,0,0
Symbolic execution with existential second-order constraints,ESEC/FSE 2018,2018,7,0,0,0,0,0
Concurrency verification with maximal path causality,ESEC/FSE 2018,2018,1,0,0,0,0,0
Automated patch extraction via syntax- and semantics-aware Delta debugging on source code changes,ESEC/FSE 2018,2018,1,0,0,0,0,0
Model transformation languages under a magnifying glass: a controlled experiment with Xtend ATL and QVT,ESEC/FSE 2018,2018,4,0,0,0,0,0
FraudDroid: automated ad fraud detection for Android apps,ESEC/FSE 2018,2018,16,0,0,0,0,0
Winning the app production rally,ESEC/FSE 2018,2018,2,0,0,0,0,0
Darwinian data structure selection,ESEC/FSE 2018,2018,1,0,0,0,0,0
RefiNym: using names to refine types,ESEC/FSE 2018,2018,2,0,0,0,0,0
Scalability-first pointer analysis with self-tuning context-sensitivity,ESEC/FSE 2018,2018,5,1,0,1,0,0
How should compilers explain problems to developers?,ESEC/FSE 2018,2018,4,0,0,0,0,0
Singularity: pattern fuzzing for worst case complexity,ESEC/FSE 2018,2018,4,1,0,0,1,0
Practical AJAX race detection for JavaScript web applications,ESEC/FSE 2018,2018,2,1,1,1,0,0
Feedback-directed differential testing of interactive debuggers,ESEC/FSE 2018,2018,5,1,1,1,0,0
Complementing global and local contexts in representing API descriptions to improve API retrieval tasks,ESEC/FSE 2018,2018,3,0,0,0,0,0
Phys: probabilistic physical unit assignment and inconsistency detection,ESEC/FSE 2018,2018,1,1,1,1,0,0
Syntax-guided synthesis of Datalog programs,ESEC/FSE 2018,2018,8,1,0,1,0,0
